{
	"to_universal": [
		{
			"function": "map_properties",
			"options": {
				"block_data": {
					"0": [
						{
							"function": "new_block",
							"options": "universal_minecraft:stone_bricks"
						},
						{
							"function": "new_properties",
							"options": {
								"variant": "normal"
							}
						}
					],
					"1": [
						{
							"function": "new_block",
							"options": "universal_minecraft:stone_bricks"
						},
						{
							"function": "new_properties",
							"options": {
								"variant": "mossy"
							}
						}
					],
					"2": [
						{
							"function": "new_block",
							"options": "universal_minecraft:stone_bricks"
						},
						{
							"function": "new_properties",
							"options": {
								"variant": "cracked"
							}
						}
					],
					"3": [
						{
							"function": "new_block",
							"options": "universal_minecraft:chiseled_stone_bricks"
						}
					]
				}
			}
		}
	],
	"from_universal": {
		"universal_minecraft:stone_bricks": [
			{
				"function": "new_block",
				"options": "minecraft:stonebrick"
			},
			{
				"function": "map_properties",
				"options": {
					"variant": {
						"normal": [
							{
								"function": "new_properties",
								"options": {
									"block_data": "0"
								}
							}
						],
						"mossy": [
							{
								"function": "new_properties",
								"options": {
									"block_data": "1"
								}
							}
						],
						"cracked": [
							{
								"function": "new_properties",
								"options": {
									"block_data": "2"
								}
							}
						]
					}
				}
			}
		],
		"universal_minecraft:chiseled_stone_bricks": [
			{
				"function": "new_block",
				"options": "minecraft:stonebrick"
			},
			{
				"function": "new_properties",
				"options": {
					"block_data": "3"
				}
			}
		]
	},
	"blockstate_specification": {
		"properties": {
			"variant": [
				"normal",
				"cracked",
				"mossy",
				"chiseled"
			]
		},
		"defaults": {
			"variant": "normal"
		}
	},
	"blockstate_to_universal": [
		{
			"function": "map_properties",
			"options": {
				"variant": {
					"normal": [
						{
							"function": "new_block",
							"options": "universal_minecraft:stone_bricks"
						},
						{
							"function": "new_properties",
							"options": {
								"variant": "normal"
							}
						}
					],
					"cracked": [
						{
							"function": "new_block",
							"options": "universal_minecraft:stone_bricks"
						},
						{
							"function": "new_properties",
							"options": {
								"variant": "cracked"
							}
						}
					],
					"mossy": [
						{
							"function": "new_block",
							"options": "universal_minecraft:stone_bricks"
						},
						{
							"function": "new_properties",
							"options": {
								"variant": "mossy"
							}
						}
					],
					"chiseled": [
						{
							"function": "new_block",
							"options": "universal_minecraft:chiseled_stone_bricks"
						}
					]
				}
			}
		}
	],
	"blockstate_from_universal": {
		"universal_minecraft:stone_bricks": [
			{
				"function": "new_block",
				"options": "minecraft:stonebrick"
			},
			{
				"function": "carry_properties",
				"options": {
					"variant": [
						"normal",
						"cracked",
						"mossy"
					]
				}
			}
		],
		"universal_minecraft:chiseled_stone_bricks": [
			{
				"function": "new_block",
				"options": "minecraft:stonebrick"
			},
			{
				"function": "new_properties",
				"options": {
					"variant": "chiseled"
				}
			}
		]
	}
}